#,WORD,WORD TYPE,DERIVATIVES,DEFINITION,THESAURUS,SAMPLE SENTENCE
285,Solitary,"['Adjective']","{'Solitarily':'(adverb)'}","Alone; without others","{'':['Lonely','By oneself','On one\'s own','Single']}","I enjoy spending a few days of ``solitary` life while in the Adirondack mountains of NY."
286,Somber,"['Adjective']","{'Somberly':'(adverb)'}","Gloomy; depressing","{'':['Dark','Subdued','Sober']}","After losing the election, Hillary Clinton was very ``somber`."
287,Soothe,"['Verb']","{'Soothingly':'(adverb)'}","To calm or comfort","{'':['Pacify','Settle down','Alleviate']}","The mother sang a lullaby to ``soothe` her crying baby."
288,Squalid,"['Adjective']","{'Squalidly':'(adverb)','Squalidness':'(noun)'}","Filthy and unpleasant","{'':['Dirty','Grubby','Grimy']}","The shelter was ``squalid` and overcrowded."
289,Stable,"['Adjective']",None,"Unlikely to change or fail","{'':['Firm','Solid','Steady','Anchored']}","We're lucky to live in a country with such a ``stable` government."
290,Stagnant,"['Adjective']",{'Stagnantly':'(adverb)'},"Sluggish, showing little movement","{'':['Still','Motionless','Static','Dead']}","Japan's economy has remained ``stagnant` for the past 20 years."
292,Strategy,"['Noun']",None,"A plan to reach a desired outcome","{'':['Master plan','Grand design','Plan of action']}","The Democrats will need a good ``strategy` to win the election in 2020."
293,Subsequent,"['Adjective']","{'Subsequently':'(adverb)'}","Coming after something in time","{'':['Following','Ensuing','Next']}","President Clinton was a good president, but ``subsequent` presidents have been horrible."
294,Substitute,"['Noun']",None,"A person or thing acting in place of another","{'':['Replacement','Relief','Understudy']}","If you don't have love, strong friendships may be a good ``substitute`."
295,Subtle,"['Adjective']","{'Subtleness':'(noun)','Subtly':'(adverb)'}","Difficult to notice right away","{'':['Understated','Subdued','Fine','Delicate']}","Alice's perfume was very ``subtle`; you had to get close to her to smell it.\nDonald Trump's hair is far from ``subtle`."
296,Sufficient,"['Adjective']","{'Sufficiently':'(adverb)'}","Enough to serve a particular purpose","{'':['Plenty of','Ample','Adequate']}","Make sure you have ``sufficient` time to study for the TOEFL exam."
297,Summarize,"['Verb']","{'Summarization':'(noun)'}","To briefly give the main points","{'':['Condense','Outline','Put in a nutshell','Give the gist of']}","Please ``summarize` your lift in a two-minute elevator pitch."
298,Supervise,"['Verb']","{'Supervision':'(noun)','Supervisor':'(noun)'}","To oversee work or a process","{'':['Direct','Manage','Run','Look after']}","The ability to ``supervise` people takes much effort and can be difficult."
299,Supplant,"['Verb']",None,"To take place of something else","{'':['Supercede','Replace','Substitute for']}","The king was ``supplanted` by his treacherous younger brother who locked him in the dungeon."
300,Suspend,"['Verb']",None,"1. To temporarily stop\n2. To hang something from somewhere","{'DEF 1':['Postpone','Defer','Delay','Put on ice','Take a rain check'],'DEF 2':['Swing','Sling','String','Dangle']}","1. School was ``suspended` due to the typhoon.\n2. The large screen TV is ``suspended` from the wall."
301,Suspicious,"['Adjective']","{'Suspiciously':'(adverb)'}","Having the belief that someone is doing something dishonest or illegal","{'':['Doubtful','Unsure','Skeptical','Distrustful']}","Many Americans are ``suspicious` of the integrity of Donald Trump."
302,Sustain,"['Verb']",None,"To keep going","{'':['Carry on','Keep up','Maintain','Preserve']}","The boy stopped trying to ``sustain` his cool hairstyle after the girl ran away from him & never returned."
303,Symbolic,"['Adjective']","{'Symbolical':'(adjective)','Symbolically':'(adverb)'}","Serving as a symbol","{'':['Representative','Emblematic']}","'Is a PhD a ``symbol` of intelligence?' is a rhetorical question."
304,Technical,"['Adjective']",None,"Relating to a specific subject or craft","{'':['Scientific','High-tech','Specialized']}","All of your STEM subjects are full of ``technical` terms, which is a great compliment to young, Chinese minds."
305,Terminal,"['Adjective']","{'Terminally':'(adverb)'}","Situated at the end","{'':['Final','Last','End']}","The ``terminal` stop of Line 5 is Qianhaiwan metro station."
306,Tolerate,"['Verb']",None,"To put up with","{'':['Endure','Bear','Stomach','Deal with']}","How can Melania ``tolerate` her husband, Donald?"
307,Transfer,"['Verb']",None,"To move from one place to another","{'':['Shift','Relocate','Resettle','Transplant']}","``Transferring` work locations has become common in the modern world."
308,Transition,"['Noun']","{'Transitional':'(adjective)'}","Changing from one state or condition to another","{'':['Passage','Move','Transformation','Progression','Jump']}","The ``transition` from high school student to university student takes a while to get used to."
309,Transparent,"['Adjective']","{'Transparently':'(adverb)'}","1. See-through material\n2. Easy to detect","{'DEF 1':['Clear','Crystal clear','Translucent'],'DEF 2':['Obvious','Evident','Apparent','Plain (as the nose on your face)']}","1. The lab beaker is completely ``transparent`, which allows one to view the various reactions.\n2. His attempt to poke fun of the politician was very ``transparent`."
310,Tuition,"['Noun']",None,"The fee for instruction at a school","{'':['Fees','Charges','Bill']}","College ``tuition` prices in America for in-state public universities, have increased from $3,190 in 1987-1988 (adjusted to reflect 2017 dollars) to an average of $9,970."
